{
  "id": "88086",
  "number": 1,
  "reservationNumber": "string",
  "quandooId": "88086",
  "status": "CONFIRMED",
  "updatedAt": "2026-07-15T19:30:00",
  "capacity": 4,
  "merchantId": 88086,
  "customerId": "88086",
  "promocode": "string",
  "extraInfo": "Window table preferred if available.",
  "links": [
    {
      "href": "https://www.quandoo.com/place/sample-restaurant",
      "method": "string",
      "rel": "DETAILS"
    }
  ],
  "reservationTags": [
    1
  ]
}